[
 {
  "id": "lumbar_root_T12",
  "name": "Ventral ramus T12",
  "plexus": "lumbar_plexus",
  "parent_id": null,
  "level": "root",
  "root_contributions": "T12",
  "targets": [
   "quadratus_lumborum_l_iliolumbar",
   "quadratus_lumborum_r_iliolumbar"
  ],
  "notes": "",
  "source": "Gray's Anatomy for Students, 4th ed. (Drake, Vogl, Mitchell) ch.6; Moore KL, Dalley AF, Agur AMR, Clinically Oriented Anatomy, 8th ed. -- lumbar and sacral plexus chapters"
 },
 {
  "id": "lumbar_root_L1",
  "name": "Ventral ramus L1",
  "plexus": "lumbar_plexus",
  "parent_id": null,
  "level": "root",
  "root_contributions": "L1",
  "targets": [
   "iliopsoas_l_psoas_major",
   "iliopsoas_r_psoas_major",
   "quadratus_lumborum_l_iliolumbar",
   "quadratus_lumborum_r_iliolumbar"
  ],
  "notes": "",
  "source": "Gray's Anatomy for Students, 4th ed. (Drake, Vogl, Mitchell) ch.6; Moore KL, Dalley AF, Agur AMR, Clinically Oriented Anatomy, 8th ed. -- lumbar and sacral plexus chapters"
 },
 {
  "id": "lumbar_root_L2",
  "name": "Ventral ramus L2",
  "plexus": "lumbar_plexus",
  "parent_id": null,
  "level": "root",
  "root_contributions": "L2",
  "targets": [
   "iliopsoas_l_psoas_major",
   "iliopsoas_r_psoas_major",
   "quadratus_lumborum_l_iliolumbar",
   "quadratus_lumborum_r_iliolumbar"
  ],
  "notes": "",
  "source": "Gray's Anatomy for Students, 4th ed. (Drake, Vogl, Mitchell) ch.6; Moore KL, Dalley AF, Agur AMR, Clinically Oriented Anatomy, 8th ed. -- lumbar and sacral plexus chapters"
 },
 {
  "id": "lumbar_root_L3",
  "name": "Ventral ramus L3",
  "plexus": "lumbar_plexus",
  "parent_id": null,
  "level": "root",
  "root_contributions": "L3",
  "targets": [
   "iliopsoas_l_psoas_major",
   "iliopsoas_r_psoas_major",
   "quadratus_lumborum_l_iliolumbar",
   "quadratus_lumborum_r_iliolumbar"
  ],
  "notes": "",
  "source": "Gray's Anatomy for Students, 4th ed. (Drake, Vogl, Mitchell) ch.6; Moore KL, Dalley AF, Agur AMR, Clinically Oriented Anatomy, 8th ed. -- lumbar and sacral plexus chapters"
 },
 {
  "id": "lumbar_root_L4",
  "name": "Ventral ramus L4",
  "plexus": "lumbar_plexus",
  "parent_id": null,
  "level": "root",
  "root_contributions": "L4",
  "targets": [],
  "notes": "",
  "source": "Gray's Anatomy for Students, 4th ed. (Drake, Vogl, Mitchell) ch.6; Moore KL, Dalley AF, Agur AMR, Clinically Oriented Anatomy, 8th ed. -- lumbar and sacral plexus chapters"
 },
 {
  "id": "iliohypogastric_n",
  "name": "Iliohypogastric nerve",
  "plexus": "lumbar_plexus",
  "parent_id": "lumbar_root_L1",
  "level": "terminal_branch",
  "root_contributions": "T12-L1",
  "targets": [
   "internal_oblique_r",
   "internal_oblique_l",
   "transversus_abdominis_r",
   "transversus_abdominis_l",
   "suprapubic skin",
   "internal_oblique_l_inferior_conjoint",
   "internal_oblique_r_inferior_conjoint"
  ],
  "notes": "Emerges from psoas major's lateral border, runs anterior to quadratus lumborum.",
  "source": "Gray's Anatomy for Students, 4th ed. (Drake, Vogl, Mitchell) ch.6; Moore KL, Dalley AF, Agur AMR, Clinically Oriented Anatomy, 8th ed. -- lumbar and sacral plexus chapters"
 },
 {
  "id": "ilioinguinal_n",
  "name": "Ilioinguinal nerve",
  "plexus": "lumbar_plexus",
  "parent_id": "lumbar_root_L1",
  "level": "terminal_branch",
  "root_contributions": "L1",
  "targets": [
   "internal_oblique_r",
   "internal_oblique_l",
   "transversus_abdominis_r",
   "transversus_abdominis_l",
   "inguinal/scrotal-labial skin",
   "internal_oblique_l_inferior_conjoint",
   "internal_oblique_r_inferior_conjoint"
  ],
  "notes": "Runs parallel and inferior to iliohypogastric n., through the inguinal canal.",
  "source": "Gray's Anatomy for Students, 4th ed. (Drake, Vogl, Mitchell) ch.6; Moore KL, Dalley AF, Agur AMR, Clinically Oriented Anatomy, 8th ed. -- lumbar and sacral plexus chapters"
 },
 {
  "id": "genitofemoral_n",
  "name": "Genitofemoral nerve",
  "plexus": "lumbar_plexus",
  "parent_id": "lumbar_root_L1",
  "level": "terminal_branch",
  "root_contributions": "L1-L2",
  "targets": [
   "cremaster (genital branch)",
   "skin of femoral triangle (femoral branch)",
   "cremaster_l_main",
   "cremaster_r_main",
   "dartos_main"
  ],
  "notes": "Pierces psoas major anteriorly, splits into genital and femoral branches near the inguinal ligament.",
  "source": "Gray's Anatomy for Students, 4th ed. (Drake, Vogl, Mitchell) ch.6; Moore KL, Dalley AF, Agur AMR, Clinically Oriented Anatomy, 8th ed. -- lumbar and sacral plexus chapters"
 },
 {
  "id": "lateral_femoral_cutaneous_n",
  "name": "Lateral femoral cutaneous nerve",
  "plexus": "lumbar_plexus",
  "parent_id": "lumbar_root_L2",
  "level": "cutaneous_branch",
  "root_contributions": "L2-L3",
  "targets": [
   "lateral thigh skin"
  ],
  "notes": "Emerges from psoas major's lateral border, crosses iliacus, passes under/through the inguinal ligament near the ASIS -- entrapment here causes meralgia paresthetica.",
  "source": "Gray's Anatomy for Students, 4th ed. (Drake, Vogl, Mitchell) ch.6; Moore KL, Dalley AF, Agur AMR, Clinically Oriented Anatomy, 8th ed. -- lumbar and sacral plexus chapters"
 },
 {
  "id": "obturator_n",
  "name": "Obturator nerve",
  "plexus": "lumbar_plexus",
  "parent_id": "lumbar_root_L2",
  "level": "terminal_branch",
  "root_contributions": "L2-L4",
  "targets": [
   "obturator_externus_r",
   "obturator_externus_l",
   "adductor_longus_r",
   "adductor_longus_l",
   "adductor_brevis_r",
   "adductor_brevis_l",
   "adductor_magnus_r_adductor_part",
   "adductor_magnus_l_adductor_part",
   "gracilis_r",
   "gracilis_l",
   "pectineus_r (variable, often also femoral n.)"
  ],
  "notes": "",
  "motor_entry_point": {
   "target_muscle_compartment": [
    "adductor_magnus_r_adductor_part",
    "adductor_magnus_l_adductor_part"
   ],
   "entry_description": "Descends through psoas major, crosses the pelvic brim, passes through the obturator foramen (obturator canal) into the medial thigh, dividing into anterior (adductor longus/brevis/gracilis) and posterior (obturator externus, adductor magnus adductor part) branches."
  },
  "source": "Gray's Anatomy for Students, 4th ed. (Drake, Vogl, Mitchell) ch.6; Moore KL, Dalley AF, Agur AMR, Clinically Oriented Anatomy, 8th ed. -- lumbar and sacral plexus chapters"
 },
 {
  "id": "femoral_n",
  "name": "Femoral nerve",
  "plexus": "lumbar_plexus",
  "parent_id": "lumbar_root_L2",
  "level": "terminal_branch",
  "root_contributions": "L2-L4",
  "targets": [
   "iliopsoas_r_iliacus",
   "iliopsoas_l_iliacus",
   "sartorius_r",
   "sartorius_l",
   "pectineus_r",
   "pectineus_l",
   "rectus_femoris_r_straight_head",
   "rectus_femoris_l_straight_head",
   "rectus_femoris_r_reflected_head",
   "rectus_femoris_l_reflected_head",
   "vastus_lateralis_r_main",
   "vastus_lateralis_l_main",
   "vastus_medialis_r_longus",
   "vastus_medialis_l_longus",
   "vastus_medialis_r_obliquus",
   "vastus_medialis_l_obliquus",
   "vastus_intermedius_r_main",
   "vastus_intermedius_l_main"
  ],
  "notes": "Largest branch of the lumbar plexus.",
  "motor_entry_point": {
   "target_muscle_compartment": [
    "vastus_medialis_r_longus",
    "vastus_medialis_l_longus"
   ],
   "entry_description": "Descends in the groove between psoas major and iliacus, passes under the inguinal ligament (lateral to the femoral vessels) into the femoral triangle, then fans into anterior (sartorius, quadriceps) branches and the saphenous nerve (sensory, continues to the medial leg/foot)."
  },
  "source": "Gray's Anatomy for Students, 4th ed. (Drake, Vogl, Mitchell) ch.6; Moore KL, Dalley AF, Agur AMR, Clinically Oriented Anatomy, 8th ed. -- lumbar and sacral plexus chapters"
 },
 {
  "id": "sacral_root_L4",
  "name": "Ventral ramus L4",
  "plexus": "sacral_plexus",
  "parent_id": null,
  "level": "root",
  "root_contributions": "L4",
  "targets": [],
  "notes": "",
  "source": "Gray's Anatomy for Students, 4th ed. (Drake, Vogl, Mitchell) ch.6; Moore KL, Dalley AF, Agur AMR, Clinically Oriented Anatomy, 8th ed. -- lumbar and sacral plexus chapters"
 },
 {
  "id": "sacral_root_L5",
  "name": "Ventral ramus L5",
  "plexus": "sacral_plexus",
  "parent_id": null,
  "level": "root",
  "root_contributions": "L5",
  "targets": [],
  "notes": "",
  "source": "Gray's Anatomy for Students, 4th ed. (Drake, Vogl, Mitchell) ch.6; Moore KL, Dalley AF, Agur AMR, Clinically Oriented Anatomy, 8th ed. -- lumbar and sacral plexus chapters"
 },
 {
  "id": "sacral_root_S1",
  "name": "Ventral ramus S1",
  "plexus": "sacral_plexus",
  "parent_id": null,
  "level": "root",
  "root_contributions": "S1",
  "targets": [],
  "notes": "",
  "source": "Gray's Anatomy for Students, 4th ed. (Drake, Vogl, Mitchell) ch.6; Moore KL, Dalley AF, Agur AMR, Clinically Oriented Anatomy, 8th ed. -- lumbar and sacral plexus chapters"
 },
 {
  "id": "sacral_root_S2",
  "name": "Ventral ramus S2",
  "plexus": "sacral_plexus",
  "parent_id": null,
  "level": "root",
  "root_contributions": "S2",
  "targets": [],
  "notes": "",
  "source": "Gray's Anatomy for Students, 4th ed. (Drake, Vogl, Mitchell) ch.6; Moore KL, Dalley AF, Agur AMR, Clinically Oriented Anatomy, 8th ed. -- lumbar and sacral plexus chapters"
 },
 {
  "id": "sacral_root_S3",
  "name": "Ventral ramus S3",
  "plexus": "sacral_plexus",
  "parent_id": null,
  "level": "root",
  "root_contributions": "S3",
  "targets": [
   "coccygeus_l_main",
   "coccygeus_r_main",
   "levator_ani_l_puborectalis",
   "levator_ani_r_puborectalis"
  ],
  "notes": "",
  "source": "Gray's Anatomy for Students, 4th ed. (Drake, Vogl, Mitchell) ch.6; Moore KL, Dalley AF, Agur AMR, Clinically Oriented Anatomy, 8th ed. -- lumbar and sacral plexus chapters"
 },
 {
  "id": "sacral_root_S4",
  "name": "Ventral ramus S4",
  "plexus": "sacral_plexus",
  "parent_id": null,
  "level": "root",
  "root_contributions": "S4",
  "targets": [
   "coccygeus_l_main",
   "coccygeus_r_main",
   "levator_ani_l_puborectalis",
   "levator_ani_r_puborectalis"
  ],
  "notes": "",